{
 "season": 2026,
 "week": 5,
 "teams": [
  {
   "manager": "Max Malich",
   "proj_ppg": 97.9,
   "proj_ppg_ros": 110.28,
   "sos_avg_opp_ppg": 111.63,
   "sos_rank": 13,
   "draft_grade": -14.1,
   "draft_surplus_total": -14.1,
   "draft_picks": [
    {
     "player": "Saquon Barkley",
     "nfl_team": "PHI",
     "pos": "RB",
     "round": 1,
     "pick_in_round": 12,
     "overall": 12,
     "espn_adp": 15.0,
     "adp_deviation": 3.0,
     "surplus_value": -12.1884
    },
    {
     "player": "Derrick Henry",
     "nfl_team": "BAL",
     "pos": "RB",
     "round": 2,
     "pick_in_round": 3,
     "overall": 17,
     "espn_adp": 16.0,
     "adp_deviation": -1.0,
     "surplus_value": 6.0375
    },
    {
     "player": "Tee Higgins",
     "nfl_team": "CIN",
     "pos": "WR",
     "round": 3,
     "pick_in_round": 12,
     "overall": 40,
     "espn_adp": 43.0,
     "adp_deviation": 3.0,
     "surplus_value": 2.734
    },
    {
     "player": "Colston Loveland",
     "nfl_team": "CHI",
     "pos": "TE",
     "round": 4,
     "pick_in_round": 3,
     "overall": 45,
     "espn_adp": 42.0,
     "adp_deviation": -3.0,
     "surplus_value": -8.1283
    },
    {
     "player": "Marvin Harrison Jr.",
     "nfl_team": "ARI",
     "pos": "WR",
     "round": 5,
     "pick_in_round": 12,
     "overall": 68,
     "espn_adp": 62.0,
     "adp_deviation": -6.0,
     "surplus_value": -7.951
    },
    {
     "player": "Caleb Williams",
     "nfl_team": "CHI",
     "pos": "QB",
     "round": 6,
     "pick_in_round": 3,
     "overall": 73,
     "espn_adp": 99.0,
     "adp_deviation": 26.0,
     "surplus_value": 4.8887
    },
    {
     "player": "Matthew Golden",
     "nfl_team": "GB",
     "pos": "WR",
     "round": 7,
     "pick_in_round": 12,
     "overall": 96,
     "espn_adp": 96.0,
     "adp_deviation": 0.0,
     "surplus_value": 3.0012
    },
    {
     "player": "Dallas Goedert",
     "nfl_team": "PHI",
     "pos": "TE",
     "round": 8,
     "pick_in_round": 3,
     "overall": 101,
     "espn_adp": 114.0,
     "adp_deviation": 13.0,
     "surplus_value": 3.3901
    },
    {
     "player": "KC Concepcion",
     "nfl_team": "CLE",
     "pos": "WR",
     "round": 9,
     "pick_in_round": 12,
     "overall": 124,
     "espn_adp": 133.0,
     "adp_deviation": 9.0,
     "surplus_value": -2.4838
    },
    {
     "player": "MarShawn Lloyd",
     "nfl_team": "GB",
     "pos": "RB",
     "round": 10,
     "pick_in_round": 3,
     "overall": 129,
     "espn_adp": 158.0,
     "adp_deviation": 29.0,
     "surplus_value": -3.0191
    },
    {
     "player": "Rams D/ST",
     "nfl_team": "LAR",
     "pos": "D/ST",
     "round": 11,
     "pick_in_round": 12,
     "overall": 152,
     "espn_adp": 183.0,
     "adp_deviation": 31.0,
     "surplus_value": null
    },
    {
     "player": "Cyrus Allen",
     "nfl_team": "KC",
     "pos": "WR",
     "round": 12,
     "pick_in_round": 3,
     "overall": 157,
     "espn_adp": 295.0,
     "adp_deviation": 138.0,
     "surplus_value": 0.0
    },
    {
     "player": "Ja'Kobi Lane",
     "nfl_team": "BAL",
     "pos": "WR",
     "round": 13,
     "pick_in_round": 12,
     "overall": 180,
     "espn_adp": 199.0,
     "adp_deviation": 19.0,
     "surplus_value": 0.0
    },
    {
     "player": "Malik Washington",
     "nfl_team": "MIA",
     "pos": "WR",
     "round": 14,
     "pick_in_round": 3,
     "overall": 185,
     "espn_adp": 211.0,
     "adp_deviation": 26.0,
     "surplus_value": 0.8134
    },
    {
     "player": "Kimani Vidal",
     "nfl_team": "LAC",
     "pos": "RB",
     "round": 15,
     "pick_in_round": 12,
     "overall": 208,
     "espn_adp": 214.0,
     "adp_deviation": 6.0,
     "surplus_value": -4.8849
    },
    {
     "player": "Trey Smack",
     "nfl_team": "GB",
     "pos": "K",
     "round": 16,
     "pick_in_round": 3,
     "overall": 213,
     "espn_adp": 287.0,
     "adp_deviation": 74.0,
     "surplus_value": null
    }
   ]
  },
  {
   "manager": "Cole Maney",
   "proj_ppg": 115.0,
   "proj_ppg_ros": 110.47,
   "sos_avg_opp_ppg": 114.84,
   "sos_rank": 6,
   "draft_grade": -21.21,
   "draft_surplus_total": -21.21,
   "draft_picks": [
    {
     "player": "Puka Nacua",
     "nfl_team": "LAR",
     "pos": "WR",
     "round": 1,
     "pick_in_round": 6,
     "overall": 6,
     "espn_adp": 4.0,
     "adp_deviation": -2.0,
     "surplus_value": 1.0148
    },
    {
     "player": "Jeremiyah Love",
     "nfl_team": "ARI",
     "pos": "RB",
     "round": 2,
     "pick_in_round": 9,
     "overall": 23,
     "espn_adp": 21.0,
     "adp_deviation": -2.0,
     "surplus_value": -4.341
    },
    {
     "player": "Ladd McConkey",
     "nfl_team": "LAC",
     "pos": "WR",
     "round": 3,
     "pick_in_round": 6,
     "overall": 34,
     "espn_adp": 40.0,
     "adp_deviation": 6.0,
     "surplus_value": -6.3316
    },
    {
     "player": "Jayden Daniels",
     "nfl_team": "WSH",
     "pos": "QB",
     "round": 4,
     "pick_in_round": 9,
     "overall": 51,
     "espn_adp": 57.0,
     "adp_deviation": 6.0,
     "surplus_value": -2.4384
    },
    {
     "player": "TreVeyon Henderson",
     "nfl_team": "NE",
     "pos": "RB",
     "round": 5,
     "pick_in_round": 6,
     "overall": 62,
     "espn_adp": 63.0,
     "adp_deviation": 1.0,
     "surplus_value": -6.5785
    },
    {
     "player": "Sam LaPorta",
     "nfl_team": "DET",
     "pos": "TE",
     "round": 6,
     "pick_in_round": 9,
     "overall": 79,
     "espn_adp": 78.0,
     "adp_deviation": -1.0,
     "surplus_value": 3.5497
    },
    {
     "player": "Stefon Diggs",
     "nfl_team": "WSH",
     "pos": "WR",
     "round": 7,
     "pick_in_round": 6,
     "overall": 90,
     "espn_adp": 84.0,
     "adp_deviation": -6.0,
     "surplus_value": 0.7816
    },
    {
     "player": "J.K. Dobbins",
     "nfl_team": "DEN",
     "pos": "RB",
     "round": 8,
     "pick_in_round": 9,
     "overall": 107,
     "espn_adp": 101.0,
     "adp_deviation": -6.0,
     "surplus_value": -5.2202
    },
    {
     "player": "Josh Downs",
     "nfl_team": "IND",
     "pos": "WR",
     "round": 9,
     "pick_in_round": 6,
     "overall": 118,
     "espn_adp": 105.0,
     "adp_deviation": -13.0,
     "surplus_value": -1.5576
    },
    {
     "player": "Seahawks D/ST",
     "nfl_team": "SEA",
     "pos": "D/ST",
     "round": 10,
     "pick_in_round": 9,
     "overall": 135,
     "espn_adp": 182.0,
     "adp_deviation": 47.0,
     "surplus_value": null
    },
    {
     "player": "Keenan Allen",
     "nfl_team": "IND",
     "pos": "WR",
     "round": 11,
     "pick_in_round": 6,
     "overall": 146,
     "espn_adp": 155.0,
     "adp_deviation": 9.0,
     "surplus_value": 0.9603
    },
    {
     "player": "Rashid Shaheed",
     "nfl_team": "SEA",
     "pos": "WR",
     "round": 12,
     "pick_in_round": 9,
     "overall": 163,
     "espn_adp": 163.0,
     "adp_deviation": 0.0,
     "surplus_value": -3.0484
    },
    {
     "player": "Hunter Henry",
     "nfl_team": "NE",
     "pos": "TE",
     "round": 13,
     "pick_in_round": 6,
     "overall": 174,
     "espn_adp": 153.0,
     "adp_deviation": -21.0,
     "surplus_value": -0.4755
    },
    {
     "player": "Evan McPherson",
     "nfl_team": "CIN",
     "pos": "K",
     "round": 14,
     "pick_in_round": 9,
     "overall": 191,
     "espn_adp": 256.0,
     "adp_deviation": 65.0,
     "surplus_value": null
    },
    {
     "player": "Devaughn Vele",
     "nfl_team": "NO",
     "pos": "WR",
     "round": 15,
     "pick_in_round": 6,
     "overall": 202,
     "espn_adp": 178.0,
     "adp_deviation": -24.0,
     "surplus_value": 5.5627
    },
    {
     "player": "Jaylen Wright",
     "nfl_team": "MIA",
     "pos": "RB",
     "round": 16,
     "pick_in_round": 9,
     "overall": 219,
     "espn_adp": 221.0,
     "adp_deviation": 2.0,
     "surplus_value": -7.5667
    }
   ]
  },
  {
   "manager": "Andrew Root",
   "proj_ppg": 110.9,
   "proj_ppg_ros": 116.82,
   "sos_avg_opp_ppg": 114.9,
   "sos_rank": 5,
   "draft_grade": -11.82,
   "draft_surplus_total": -11.82,
   "draft_picks": [
    {
     "player": "Justin Jefferson",
     "nfl_team": "MIN",
     "pos": "WR",
     "round": 1,
     "pick_in_round": 13,
     "overall": 13,
     "espn_adp": 12.0,
     "adp_deviation": -1.0,
     "surplus_value": -2.4268
    },
    {
     "player": "De'Von Achane",
     "nfl_team": "MIA",
     "pos": "RB",
     "round": 2,
     "pick_in_round": 2,
     "overall": 16,
     "espn_adp": 10.0,
     "adp_deviation": -6.0,
     "surplus_value": -9.5705
    },
    {
     "player": "Davante Adams",
     "nfl_team": "LAR",
     "pos": "WR",
     "round": 3,
     "pick_in_round": 13,
     "overall": 41,
     "espn_adp": 44.0,
     "adp_deviation": 3.0,
     "surplus_value": 3.2302
    },
    {
     "player": "Tetairoa McMillan",
     "nfl_team": "CAR",
     "pos": "WR",
     "round": 4,
     "pick_in_round": 2,
     "overall": 44,
     "espn_adp": 35.0,
     "adp_deviation": -9.0,
     "surplus_value": 3.4856
    },
    {
     "player": "Rhamondre Stevenson",
     "nfl_team": "NE",
     "pos": "RB",
     "round": 5,
     "pick_in_round": 13,
     "overall": 69,
     "espn_adp": 67.0,
     "adp_deviation": -2.0,
     "surplus_value": -2.0033
    },
    {
     "player": "Harold Fannin Jr.",
     "nfl_team": "CLE",
     "pos": "TE",
     "round": 6,
     "pick_in_round": 2,
     "overall": 72,
     "espn_adp": 70.0,
     "adp_deviation": -2.0,
     "surplus_value": 2.2022
    },
    {
     "player": "Patrick Mahomes",
     "nfl_team": "KC",
     "pos": "QB",
     "round": 7,
     "pick_in_round": 13,
     "overall": 97,
     "espn_adp": 108.0,
     "adp_deviation": 11.0,
     "surplus_value": 4.3202
    },
    {
     "player": "Travis Kelce",
     "nfl_team": "KC",
     "pos": "TE",
     "round": 8,
     "pick_in_round": 2,
     "overall": 100,
     "espn_adp": 107.0,
     "adp_deviation": 7.0,
     "surplus_value": 3.8482
    },
    {
     "player": "Jayden Reed",
     "nfl_team": "GB",
     "pos": "WR",